{
  "schemaVersion": "1.0.0",
  "batchId": "sweep-2026-08-epc-minigrid-031",
  "status": {
    "candidateOnly": true,
    "publicationAuthorised": false,
    "humanReviewRequired": true
  },
  "source": {
    "kind": "agent_web_sweep",
    "asOf": "2026-08-27",
    "sha256": "62909804f5d391aeab2c9dcbd41c5ca253c12a86f0d7e9fccd6c9f62ef86d47e"
  },
  "inventorySummary": {
    "rowsParsed": 1507,
    "canonicalMatches": 0,
    "catalogueMatches": 203,
    "newCandidates": 1292,
    "ambiguous": 0,
    "needsSplit": 0
  },
  "candidates": [
    {
      "candidateId": "cand_org_ets_bah_mamadou_bhoye_et_fils_ab1ca4a1",
      "sourceRow": 1,
      "submittedName": "Ets Bah Mamadou Bhoye et Fils",
      "submittedWebsite": "",
      "submittedHeadquarters": "GN",
      "submittedStakeholderType": "EPC/Installer",
      "submittedSegments": [
        "org_segment_shs_paygo"
      ],
      "submittedOwnershipType": "",
      "submittedScaleIndicator": "",
      "submittedNotes": "Named among Guinea's manufacturer representatives acting as local distributors of international solar brands.",
      "recordShape": "organisation",
      "suggestedActorGroupId": "org_group_oems",
      "suggestedRoleIds": [
        "org_role_distributor",
        "org_role_installer"
      ],
      "suggestedSegmentIds": [
        "org_segment_shs_paygo"
      ],
      "sourceLeads": [
        "https://old.greenmaxcap.com/download/ROGEP%20Reports/Guinea/ECREEE%20ROGEP_Guinea_Final%20Report_FR.pdf"
      ],
      "reconciliation": {
        "status": "new_candidate",
        "matchedOn": "none"
      },
      "reviewState": "needs_source_review"
    },
    {
      "candidateId": "cand_org_ets_kamab_2bf7cac8",
      "sourceRow": 2,
      "submittedName": "ETS Kamab",
      "submittedWebsite": "",
      "submittedHeadquarters": "GN",
      "submittedStakeholderType": "EPC/Installer",
      "submittedSegments": [
        "org_segment_shs_paygo"
      ],
      "submittedOwnershipType": "",
      "submittedScaleIndicator": "",
      "submittedNotes": "Named in prose (as 'Ets Kamab') among Guinea's manufacturer representatives; Tableau 37 lists it (as 'ETS Kamab') across all four system size categories including very large system supply.",
      "recordShape": "organisation",
      "suggestedActorGroupId": "org_group_oems",
      "suggestedRoleIds": [
        "org_role_distributor",
        "org_role_installer"
      ],
      "suggestedSegmentIds": [
        "org_segment_shs_paygo"
      ],
      "sourceLeads": [
        "https://old.greenmaxcap.com/download/ROGEP%20Reports/Guinea/ECREEE%20ROGEP_Guinea_Final%20Report_FR.pdf"
      ],
      "reconciliation": {
        "status": "new_candidate",
        "matchedOn": "none"
      },
      "reviewState": "needs_source_review"
    },
    {
      "candidateId": "cand_org_2hk_energie_ff4b0475",
      "sourceRow": 3,
      "submittedName": "2HK Energie",
      "submittedWebsite": "",
      "submittedHeadquarters": "GN",
      "submittedStakeholderType": "EPC/Installer",
      "submittedSegments": [
        "org_segment_shs_paygo"
      ],
      "submittedOwnershipType": "",
      "submittedScaleIndicator": "",
      "submittedNotes": "Named in prose (as '2HK') among Guinea's manufacturer representatives; Tableau 37 lists it as '2HK Energie' across all four system size categories.",
      "recordShape": "organisation",
      "suggestedActorGroupId": "org_group_oems",
      "suggestedRoleIds": [
        "org_role_distributor",
        "org_role_installer"
      ],
      "suggestedSegmentIds": [
        "org_segment_shs_paygo"
      ],
      "sourceLeads": [
        "https://old.greenmaxcap.com/download/ROGEP%20Reports/Guinea/ECREEE%20ROGEP_Guinea_Final%20Report_FR.pdf"
      ],
      "reconciliation": {
        "status": "new_candidate",
        "matchedOn": "none"
      },
      "reviewState": "needs_source_review"
    },
    {
      "candidateId": "cand_org_bh_soger_4f0b165b",
      "sourceRow": 4,
      "submittedName": "BH Soger",
      "submittedWebsite": "",
      "submittedHeadquarters": "GN",
      "submittedStakeholderType": "EPC/Installer",
      "submittedSegments": [
        "org_segment_shs_paygo"
      ],
      "submittedOwnershipType": "",
      "submittedScaleIndicator": "",
      "submittedNotes": "Listed in Tableau 37 'Produits et composants solaires hors réseau en Guinée' across all four system categories (pico lantern, single-module, multi-module and very large system supply).",
      "recordShape": "organisation",
      "suggestedActorGroupId": "org_group_oems",
      "suggestedRoleIds": [
        "org_role_distributor",
        "org_role_installer"
      ],
      "suggestedSegmentIds": [
        "org_segment_shs_paygo"
      ],
      "sourceLeads": [
        "https://old.greenmaxcap.com/download/ROGEP%20Reports/Guinea/ECREEE%20ROGEP_Guinea_Final%20Report_FR.pdf"
      ],
      "reconciliation": {
        "status": "new_candidate",
        "matchedOn": "none"
      },
      "reviewState": "needs_source_review"
    },
    {
      "candidateId": "cand_org_my_cebel_solaire_61432d5c",
      "sourceRow": 5,
      "submittedName": "My Cebel Solaire",
      "submittedWebsite": "",
      "submittedHeadquarters": "GN",
      "submittedStakeholderType": "EPC/Installer",
      "submittedSegments": [
        "org_segment_shs_paygo"
      ],
      "submittedOwnershipType": "",
      "submittedScaleIndicator": "",
      "submittedNotes": "Listed in Tableau 37 across all four system size categories including 'Très grand fournisseur de systèmes'.",
      "recordShape": "organisation",
      "suggestedActorGroupId": "org_group_oems",
      "suggestedRoleIds": [
        "org_role_distributor",
        "org_role_installer"
      ],
      "suggestedSegmentIds": [
        "org_segment_shs_paygo"
      ],
      "sourceLeads": [
        "https://old.greenmaxcap.com/download/ROGEP%20Reports/Guinea/ECREEE%20ROGEP_Guinea_Final%20Report_FR.pdf"
      ],
      "reconciliation": {
        "status": "new_candidate",
        "matchedOn": "none"
      },
      "reviewState": "needs_source_review"
    },
    {
      "candidateId": "cand_org_solar_guin_e_a49c0776",
      "sourceRow": 6,
      "submittedName": "Solar Guinée",
      "submittedWebsite": "",
      "submittedHeadquarters": "GN",
      "submittedStakeholderType": "EPC/Installer",
      "submittedSegments": [
        "org_segment_shs_paygo"
      ],
      "submittedOwnershipType": "",
      "submittedScaleIndicator": "",
      "submittedNotes": "Listed in Tableau 37 across all four system size categories including very large system supply.",
      "recordShape": "organisation",
      "suggestedActorGroupId": "org_group_oems",
      "suggestedRoleIds": [
        "org_role_distributor",
        "org_role_installer"
      ],
      "suggestedSegmentIds": [
        "org_segment_shs_paygo"
      ],
      "sourceLeads": [
        "https://old.greenmaxcap.com/download/ROGEP%20Reports/Guinea/ECREEE%20ROGEP_Guinea_Final%20Report_FR.pdf"
      ],
      "reconciliation": {
        "status": "new_candidate",
        "matchedOn": "none"
      },
      "reviewState": "needs_source_review"
    },
    {
      "candidateId": "cand_org_solec_energy_63df86f6",
      "sourceRow": 7,
      "submittedName": "Solec Energy",
      "submittedWebsite": "",
      "submittedHeadquarters": "GN",
      "submittedStakeholderType": "EPC/Installer",
      "submittedSegments": [
        "org_segment_shs_paygo"
      ],
      "submittedOwnershipType": "",
      "submittedScaleIndicator": "",
      "submittedNotes": "Listed in Tableau 37 across all four system size categories including very large system supply.",
      "recordShape": "organisation",
      "suggestedActorGroupId": "org_group_oems",
      "suggestedRoleIds": [
        "org_role_distributor",
        "org_role_installer"
      ],
      "suggestedSegmentIds": [
        "org_segment_shs_paygo"
      ],
      "sourceLeads": [
        "https://old.greenmaxcap.com/download/ROGEP%20Reports/Guinea/ECREEE%20ROGEP_Guinea_Final%20Report_FR.pdf"
      ],
      "reconciliation": {
        "status": "new_candidate",
        "matchedOn": "none"
      },
      "reviewState": "needs_source_review"
    },
    {
      "candidateId": "cand_org_doumbouya_solar_electric_6ed574cf",
      "sourceRow": 8,
      "submittedName": "Doumbouya Solar Electric",
      "submittedWebsite": "",
      "submittedHeadquarters": "GN",
      "submittedStakeholderType": "EPC/Installer",
      "submittedSegments": [
        "org_segment_shs_paygo"
      ],
      "submittedOwnershipType": "",
      "submittedScaleIndicator": "",
      "submittedNotes": "Listed in Tableau 37 across all four system size categories including very large system supply.",
      "recordShape": "organisation",
      "suggestedActorGroupId": "org_group_oems",
      "suggestedRoleIds": [
        "org_role_distributor",
        "org_role_installer"
      ],
      "suggestedSegmentIds": [
        "org_segment_shs_paygo"
      ],
      "sourceLeads": [
        "https://old.greenmaxcap.com/download/ROGEP%20Reports/Guinea/ECREEE%20ROGEP_Guinea_Final%20Report_FR.pdf"
      ],
      "reconciliation": {
        "status": "new_candidate",
        "matchedOn": "none"
      },
      "reviewState": "needs_source_review"
    },
    {
      "candidateId": "cand_org_ard_equipements_2ec3f797",
      "sourceRow": 9,
      "submittedName": "ARD Equipements",
      "submittedWebsite": "",
      "submittedHeadquarters": "GN",
      "submittedStakeholderType": "EPC/Installer",
      "submittedSegments": [
        "org_segment_shs_paygo"
      ],
      "submittedOwnershipType": "",
      "submittedScaleIndicator": "",
      "submittedNotes": "Listed in Tableau 37 across all four system size categories including very large system supply.",
      "recordShape": "organisation",
      "suggestedActorGroupId": "org_group_oems",
      "suggestedRoleIds": [
        "org_role_distributor",
        "org_role_installer"
      ],